[{"state":"AL","year":2006,"pills":0,"pills_per_capita":0.0},{"state":"AL","year":2007,"pills":0,"pills_per_capita":0.0},{"state":"AL","year":2008,"pills":0,"pills_per_capita":0.0},{"state":"AL","year":2009,"pills":0,"pills_per_capita":0.0},{"state":"AL","year":2010,"pills":0,"pills_per_capita":0.0},{"state":"AL","year":2011,"pills":0,"pills_per_capita":0.0},{"state":"AL","year":2012,"pills":0,"pills_per_capita":0.0},{"state":"AL","year":2013,"pills":0,"pills_per_capita":0.0},{"state":"AL","year":2014,"pills":0,"pills_per_capita":0.0},{"state":"AK","year":2006,"pills":0,"pills_per_capita":0.0},{"state":"AK","year":2007,"pills":0,"pills_per_capita":0.0},{"state":"AK","year":2008,"pills":0,"pills_per_capita":0.0},{"state":"AK","year":2009,"pills":0,"pills_per_capita":0.0},{"state":"AK","year":2010,"pills":0,"pills_per_capita":0.0},{"state":"AK","year":2011,"pills":0,"pills_per_capita":0.0},{"state":"AK","year":2012,"pills":0,"pills_per_capita":0.0},{"state":"AK","year":2013,"pills":0,"pills_per_capita":0.0},{"state":"AK","year":2014,"pills":0,"pills_per_capita":0.0},{"state":"AZ","year":2006,"pills":0,"pills_per_capita":0.0},{"state":"AZ","year":2007,"pills":0,"pills_per_capita":0.0},{"state":"AZ","year":2008,"pills":0,"pills_per_capita":0.0},{"state":"AZ","year":2009,"pills":0,"pills_per_capita":0.0},{"state":"AZ","year":2010,"pills":0,"pills_per_capita":0.0},{"state":"AZ","year":2011,"pills":0,"pills_per_capita":0.0},{"state":"AZ","year":2012,"pills":0,"pills_per_capita":0.0},{"state":"AZ","year":2013,"pills":0,"pills_per_capita":0.0},{"state":"AZ","year":2014,"pills":0,"pills_per_capita":0.0},{"state":"AR","year":2006,"pills":0,"pills_per_capita":0.0},{"state":"AR","year":2007,"pills":0,"pills_per_capita":0.0},{"state":"AR","year":2008,"pills":0,"pills_per_capita":0.0},{"state":"AR","year":2009,"pills":0,"pills_per_capita":0.0},{"state":"AR","year":2010,"pills":0,"pills_per_capita":0.0},{"state":"AR","year":2011,"pills":0,"pills_per_capita":0.0},{"state":"AR","year":2012,"pills":0,"pills_per_capita":0.0},{"state":"AR","year":2013,"pills":0,"pills_per_capita":0.0},{"state":"AR","year":2014,"pills":0,"pills_per_capita":0.0},{"state":"CA","year":2006,"pills":0,"pills_per_capita":0.0},{"state":"CA","year":2007,"pills":0,"pills_per_capita":0.0},{"state":"CA","year":2008,"pills":0,"pills_per_capita":0.0},{"state":"CA","year":2009,"pills":0,"pills_per_capita":0.0},{"state":"CA","year":2010,"pills":0,"pills_per_capita":0.0},{"state":"CA","year":2011,"pills":0,"pills_per_capita":0.0},{"state":"CA","year":2012,"pills":0,"pills_per_capita":0.0},{"state":"CA","year":2013,"pills":0,"pills_per_capita":0.0},{"state":"CA","year":2014,"pills":0,"pills_per_capita":0.0},{"state":"CO","year":2006,"pills":0,"pills_per_capita":0.0},{"state":"CO","year":2007,"pills":0,"pills_per_capita":0.0},{"state":"CO","year":2008,"pills":0,"pills_per_capita":0.0},{"state":"CO","year":2009,"pills":0,"pills_per_capita":0.0},{"state":"CO","year":2010,"pills":0,"pills_per_capita":0.0},{"state":"CO","year":2011,"pills":0,"pills_per_capita":0.0},{"state":"CO","year":2012,"pills":0,"pills_per_capita":0.0},{"state":"CO","year":2013,"pills":0,"pills_per_capita":0.0},{"state":"CO","year":2014,"pills":0,"pills_per_capita":0.0},{"state":"CT","year":2006,"pills":0,"pills_per_capita":0.0},{"state":"CT","year":2007,"pills":0,"pills_per_capita":0.0},{"state":"CT","year":2008,"pills":0,"pills_per_capita":0.0},{"state":"CT","year":2009,"pills":0,"pills_per_capita":0.0},{"state":"CT","year":2010,"pills":0,"pills_per_capita":0.0},{"state":"CT","year":2011,"pills":0,"pills_per_capita":0.0},{"state":"CT","year":2012,"pills":0,"pills_per_capita":0.0},{"state":"CT","year":2013,"pills":0,"pills_per_capita":0.0},{"state":"CT","year":2014,"pills":0,"pills_per_capita":0.0},{"state":"DE","year":2006,"pills":0,"pills_per_capita":0.0},{"state":"DE","year":2007,"pills":0,"pills_per_capita":0.0},{"state":"DE","year":2008,"pills":0,"pills_per_capita":0.0},{"state":"DE","year":2009,"pills":0,"pills_per_capita":0.0},{"state":"DE","year":2010,"pills":0,"pills_per_capita":0.0},{"state":"DE","year":2011,"pills":0,"pills_per_capita":0.0},{"state":"DE","year":2012,"pills":0,"pills_per_capita":0.0},{"state":"DE","year":2013,"pills":0,"pills_per_capita":0.0},{"state":"DE","year":2014,"pills":0,"pills_per_capita":0.0},{"state":"DC","year":2006,"pills":0,"pills_per_capita":0.0},{"state":"DC","year":2007,"pills":0,"pills_per_capita":0.0},{"state":"DC","year":2008,"pills":0,"pills_per_capita":0.0},{"state":"DC","year":2009,"pills":0,"pills_per_capita":0.0},{"state":"DC","year":2010,"pills":0,"pills_per_capita":0.0},{"state":"DC","year":2011,"pills":0,"pills_per_capita":0.0},{"state":"DC","year":2012,"pills":0,"pills_per_capita":0.0},{"state":"DC","year":2013,"pills":0,"pills_per_capita":0.0},{"state":"DC","year":2014,"pills":0,"pills_per_capita":0.0},{"state":"FL","year":2006,"pills":0,"pills_per_capita":0.0},{"state":"FL","year":2007,"pills":0,"pills_per_capita":0.0},{"state":"FL","year":2008,"pills":0,"pills_per_capita":0.0},{"state":"FL","year":2009,"pills":0,"pills_per_capita":0.0},{"state":"FL","year":2010,"pills":0,"pills_per_capita":0.0},{"state":"FL","year":2011,"pills":0,"pills_per_capita":0.0},{"state":"FL","year":2012,"pills":0,"pills_per_capita":0.0},{"state":"FL","year":2013,"pills":0,"pills_per_capita":0.0},{"state":"FL","year":2014,"pills":0,"pills_per_capita":0.0},{"state":"GA","year":2006,"pills":0,"pills_per_capita":0.0},{"state":"GA","year":2007,"pills":0,"pills_per_capita":0.0},{"state":"GA","year":2008,"pills":0,"pills_per_capita":0.0},{"state":"GA","year":2009,"pills":0,"pills_per_capita":0.0},{"state":"GA","year":2010,"pills":0,"pills_per_capita":0.0},{"state":"GA","year":2011,"pills":0,"pills_per_capita":0.0},{"state":"GA","year":2012,"pills":0,"pills_per_capita":0.0},{"state":"GA","year":2013,"pills":0,"pills_per_capita":0.0},{"state":"GA","year":2014,"pills":0,"pills_per_capita":0.0},{"state":"HI","year":2006,"pills":0,"pills_per_capita":0.0},{"state":"HI","year":2007,"pills":0,"pills_per_capita":0.0},{"state":"HI","year":2008,"pills":0,"pills_per_capita":0.0},{"state":"HI","year":2009,"pills":0,"pills_per_capita":0.0},{"state":"HI","year":2010,"pills":0,"pills_per_capita":0.0},{"state":"HI","year":2011,"pills":0,"pills_per_capita":0.0},{"state":"HI","year":2012,"pills":0,"pills_per_capita":0.0},{"state":"HI","year":2013,"pills":0,"pills_per_capita":0.0},{"state":"HI","year":2014,"pills":0,"pills_per_capita":0.0},{"state":"ID","year":2006,"pills":0,"pills_per_capita":0.0},{"state":"ID","year":2007,"pills":0,"pills_per_capita":0.0},{"state":"ID","year":2008,"pills":0,"pills_per_capita":0.0},{"state":"ID","year":2009,"pills":0,"pills_per_capita":0.0},{"state":"ID","year":2010,"pills":0,"pills_per_capita":0.0},{"state":"ID","year":2011,"pills":0,"pills_per_capita":0.0},{"state":"ID","year":2012,"pills":0,"pills_per_capita":0.0},{"state":"ID","year":2013,"pills":0,"pills_per_capita":0.0},{"state":"ID","year":2014,"pills":0,"pills_per_capita":0.0},{"state":"IL","year":2006,"pills":0,"pills_per_capita":0.0},{"state":"IL","year":2007,"pills":0,"pills_per_capita":0.0},{"state":"IL","year":2008,"pills":0,"pills_per_capita":0.0},{"state":"IL","year":2009,"pills":0,"pills_per_capita":0.0},{"state":"IL","year":2010,"pills":0,"pills_per_capita":0.0},{"state":"IL","year":2011,"pills":0,"pills_per_capita":0.0},{"state":"IL","year":2012,"pills":0,"pills_per_capita":0.0},{"state":"IL","year":2013,"pills":0,"pills_per_capita":0.0},{"state":"IL","year":2014,"pills":0,"pills_per_capita":0.0},{"state":"IN","year":2006,"pills":0,"pills_per_capita":0.0},{"state":"IN","year":2007,"pills":0,"pills_per_capita":0.0},{"state":"IN","year":2008,"pills":0,"pills_per_capita":0.0},{"state":"IN","year":2009,"pills":0,"pills_per_capita":0.0},{"state":"IN","year":2010,"pills":0,"pills_per_capita":0.0},{"state":"IN","year":2011,"pills":0,"pills_per_capita":0.0},{"state":"IN","year":2012,"pills":0,"pills_per_capita":0.0},{"state":"IN","year":2013,"pills":0,"pills_per_capita":0.0},{"state":"IN","year":2014,"pills":0,"pills_per_capita":0.0},{"state":"IA","year":2006,"pills":0,"pills_per_capita":0.0},{"state":"IA","year":2007,"pills":0,"pills_per_capita":0.0},{"state":"IA","year":2008,"pills":0,"pills_per_capita":0.0},{"state":"IA","year":2009,"pills":0,"pills_per_capita":0.0},{"state":"IA","year":2010,"pills":0,"pills_per_capita":0.0},{"state":"IA","year":2011,"pills":0,"pills_per_capita":0.0},{"state":"IA","year":2012,"pills":0,"pills_per_capita":0.0},{"state":"IA","year":2013,"pills":0,"pills_per_capita":0.0},{"state":"IA","year":2014,"pills":0,"pills_per_capita":0.0},{"state":"KS","year":2006,"pills":0,"pills_per_capita":0.0},{"state":"KS","year":2007,"pills":0,"pills_per_capita":0.0},{"state":"KS","year":2008,"pills":0,"pills_per_capita":0.0},{"state":"KS","year":2009,"pills":0,"pills_per_capita":0.0},{"state":"KS","year":2010,"pills":0,"pills_per_capita":0.0},{"state":"KS","year":2011,"pills":0,"pills_per_capita":0.0},{"state":"KS","year":2012,"pills":0,"pills_per_capita":0.0},{"state":"KS","year":2013,"pills":0,"pills_per_capita":0.0},{"state":"KS","year":2014,"pills":0,"pills_per_capita":0.0},{"state":"KY","year":2006,"pills":8980000,"pills_per_capita":2.0472621174891357},{"state":"KY","year":2007,"pills":9409400,"pills_per_capita":2.145156811614952},{"state":"KY","year":2008,"pills":9860662,"pills_per_capita":2.248035608682033},{"state":"KY","year":2009,"pills":10334987,"pills_per_capita":2.356172312900077},{"state":"KY","year":2010,"pills":10833654,"pills_per_capita":2.469858510933702},{"state":"KY","year":2011,"pills":11358012,"pills_per_capita":2.5894017480609146},{"state":"KY","year":2012,"pills":10449372,"pills_per_capita":2.382249827077025},{"state":"KY","year":2013,"pills":9613421,"pills_per_capita":2.191669558215426},{"state":"KY","year":2014,"pills":8844347,"pills_per_capita":2.0163359206045306},{"state":"LA","year":2006,"pills":0,"pills_per_capita":0.0},{"state":"LA","year":2007,"pills